"conversation_id_str","created_at","favorite_count","full_text","id_str","image_url","in_reply_to_screen_name","lang","location","quote_count","reply_count","retweet_count","tweet_url","user_id_str","username"
"1299270762990370818","Fri Aug 28 09:01:03 +0000 2020","0","Pemerintah akan tetap melanjutkan pemindahan ibu kota negara (IKN) ke Kaltim. Megaproyek itu menjadi penggerak ekonomi di tengah pandemi Covid-19. https://t.co/Tw5XGbYTwi","1299270762990370818","","","in","Bontang, Kaltim, Indonesia","0","0","0","https://twitter.com/bontang_post/status/1299270762990370818","3101199283","bontang_post"
"1298903251429912576","Thu Aug 27 08:40:42 +0000 2020","1","Saya optimis soal rencana pemindahan Ibu Kota Baru (IKN) di Kaltim akan terwujud. Tentu dengan alasan-alasan logis. Untuk informasi terbaru dan progres IKN. Video lengkapnya bisa dicek disini; https://t.co/XnBOfV2S9y","1298903251429912576","","","in","Kalimantan Timur","0","0","0","https://twitter.com/suara_irwan/status/1298903251429912576","992654911383846913","suara_irwan"
"1298992871178006528","Thu Aug 27 14:36:49 +0000 2020","0","Terkait rencana pemindahan ibukota negara (IKN) ke wilayah Kalimantan Timur masih mengundang Tanya masyarakat Kaltim. Apakah Pemeritah Pusat serius membangun lokasi IKN baru di sebagian wilayah PPU dan Kutai Kartanegara. #HeadlineKaltim #kaltim #ikn https://t.co/Od1GXQ0Q6j","1298992871178006528","","","in","Kalimantan Timur","0","0","0","https://twitter.com/headlinekaltim/status/1298992871178006528","1289517565559992321","headlinekaltim"
"1298588353479282690","Wed Aug 26 11:49:24 +0000 2020","0","Sejak diumumkan Presiden Joko Widodo pada 26 Agustus 2019 lalu Pemprov Kaltim terus mendukung upaya pemerintah pusat memindahkan ibu kota negara (IKN) dari Jakarta ke Kabupaten Kutai Kartanegara dan Penajam Paser https://t.co/iFlfqW2Mz2","1298588353479282690","","","in","Samarinda-Kaltim","0","0","0","https://twitter.com/KPFM968/status/1298588353479282690","159463473","KPFM968"
"1297621631372636165","Sun Aug 23 19:48:00 +0000 2020","0","PT Perusahaan Listrik Negara (Persero) atau PLN siap memenuhi kebutuhan listrik Ibu Kota Negara (IKN) di Sepaku Penajam Paser Utara Kalimantan Timur (Kaltim). #pln #listrik #kalimantan #ibukota https://t.co/X3tz8E8x0Y","1297621631372636165","","","in","Jakarta, Indonesia","0","0","0","https://twitter.com/inewsdotid/status/1297621631372636165","944180887171743745","inewsdotid"
